{
  "schemaVersion": "2.0.0",
  "id": "doc:bdns:synthetic-2026-001:call",
  "revisionId": "docrev:sha256:1111111111111111111111111111111111111111111111111111111111111111",
  "officialUrl": "https://official.example.invalid/documents/SYNTHETIC-2026-001.pdf",
  "role": "call",
  "mimeType": "application/pdf",
  "language": "es",
  "publishedAt": "2026-09-01T00:00:00+02:00",
  "byteSize": 4096,
  "sha256": "sha256:1111111111111111111111111111111111111111111111111111111111111111",
  "extraction": {
    "method": "native_text",
    "version": "pdf-text-v2.0.0",
    "pageCount": 12,
    "quality": 0.98
  },
  "relations": [],
  "sourceRecordIds": ["src:bdns:synthetic-2026-001"],
  "dependentClaimIds": ["claim:opp:synthetic-2026-001:deadline"]
}
